{"$defs":{"digest":{"pattern":"^sha256:[0-9a-f]{64}$","type":"string"},"forbiddenRule":{"additionalProperties":false,"properties":{"allowed_section_or_path_patterns":{"items":{"type":"string"},"type":"array","uniqueItems":true},"match_mode":{"enum":["case_sensitive","case_insensitive"]},"reason":{"minLength":1,"type":"string"},"token":{"minLength":1,"type":"string"}},"required":["token","match_mode","allowed_section_or_path_patterns","reason"],"type":"object"}},"$id":"https://aurora.local/schemas/gtbi/v7/master_plan_audit_scope_manifest_v1.schema.json","$schema":"https://json-schema.org/draft/2020-12/schema","additionalProperties":false,"properties":{"canonical_serialization_profile_digest":{"$ref":"#/$defs/digest"},"hash_domain_registry_digest":{"$ref":"#/$defs/digest"},"ordered_forbidden_term_rules":{"items":{"$ref":"#/$defs/forbiddenRule"},"type":"array"},"ordered_review_dimensions":{"items":false,"maxItems":4,"minItems":4,"prefixItems":[{"const":"architecture_and_state_reachability"},{"const":"scientific_and_temporal_integrity"},{"const":"security_and_custody"},{"const":"operations_and_billing"}],"type":"array"},"ordered_structural_checks":{"items":false,"maxItems":10,"minItems":10,"prefixItems":[{"const":"canonical_text_bytes"},{"const":"unique_task_ids"},{"const":"known_dependency_references"},{"const":"acyclic_dependency_graph"},{"const":"complete_gate_assignment"},{"const":"contiguous_execution_order"},{"const":"balanced_code_fences"},{"const":"valid_markdown_tables"},{"const":"valid_urls"},{"const":"no_stale_forbidden_terms"}],"type":"array"},"required_evidence_classes":{"items":{"minLength":1,"type":"string"},"minItems":1,"type":"array","uniqueItems":true},"reviewed_master_plan_byte_length":{"maximum":9007199254740991,"minimum":1,"type":"integer"},"reviewed_master_plan_git_blob_id":{"pattern":"^[0-9a-f]{40}$","type":"string"},"reviewed_master_plan_path":{"const":"docs/plans/gtbi-v7-master-plan.md"},"reviewed_master_plan_sha256":{"$ref":"#/$defs/digest"},"schema_version":{"const":"master_plan_audit_scope_manifest_v1"},"scope_manifest_digest":{"$ref":"#/$defs/digest"},"tool_independent_acceptance_predicates":{"items":{"minLength":1,"type":"string"},"minItems":1,"type":"array","uniqueItems":true}},"required":["schema_version","reviewed_master_plan_path","reviewed_master_plan_sha256","reviewed_master_plan_byte_length","reviewed_master_plan_git_blob_id","canonical_serialization_profile_digest","hash_domain_registry_digest","ordered_review_dimensions","ordered_structural_checks","tool_independent_acceptance_predicates","required_evidence_classes","ordered_forbidden_term_rules","scope_manifest_digest"],"title":"GTBI V7 master-plan audit scope manifest","type":"object","x-gtbi-digest-result-name":"scope_manifest_digest","x-gtbi-digest-storage":"self_field","x-gtbi-hash-domain-id":"GTBI_MASTER_PLAN_AUDIT_SCOPE_V1","x-gtbi-logical-schema-id":"master_plan_audit_scope_manifest_v1"}
