{"canonical_serialization_profile_digest":"sha256:1ee1fca10ec1a9d2bbe707cadbeb3eb49ead8cbe173199011d3620530b2f1350","hash_domain_registry_digest":"sha256:3eb673a8d30063ab77eaf10f945b0817670df4cef596bc897c422b8ff1b7188c","ordered_forbidden_term_rules":[{"allowed_section_or_path_patterns":["generic term `checkpoint writer` is forbidden"],"match_mode":"case_sensitive","reason":"Machine policy must use the exact scoped checkpoint role names.","token":"checkpoint writer"},{"allowed_section_or_path_patterns":["shorter token `V7_CANONICAL` is forbidden"],"match_mode":"case_sensitive","reason":"Machine records must use the complete canonical commit identity.","token":"V7_CANONICAL"}],"ordered_review_dimensions":["architecture_and_state_reachability","scientific_and_temporal_integrity","security_and_custody","operations_and_billing"],"ordered_structural_checks":["canonical_text_bytes","unique_task_ids","known_dependency_references","acyclic_dependency_graph","complete_gate_assignment","contiguous_execution_order","balanced_code_fences","valid_markdown_tables","valid_urls","no_stale_forbidden_terms"],"required_evidence_classes":["structural_validation_report","owner_simplification_directive","deterministic_contract_regeneration"],"reviewed_master_plan_byte_length":825401,"reviewed_master_plan_git_blob_id":"bda2053467ac8f57d4af7b395346275c25648856","reviewed_master_plan_path":"docs/plans/gtbi-v7-master-plan.md","reviewed_master_plan_sha256":"sha256:31686d8615175399fa89e10f284d90c3ce5cd03aa36930e9b1026c389a44b348","schema_version":"master_plan_audit_scope_manifest_v1","scope_manifest_digest":"sha256:863178538be6cf0fdf7eca6a037cb3059369248b55958df212292f79779cbaff","tool_independent_acceptance_predicates":["all_four_review_dimensions_are_covered","all_registered_structural_checks_pass","finding_count_is_zero","result_is_CLEAN","reviewed_bytes_match_sha_length_and_git_blob","owner_simplification_directive_is_canonical_and_accepted","owner_directive_supersedes_legacy_independence_requirements"]}
